{
  "schemaVersion": "1.0",
  "deckId": "rws-original",
  "auditVersion": "1.0.0",
  "auditedAt": "2026-07-20",
  "status": "verified-candidate",
  "category": {
    "title": "Rider-Waite-Smith tarot deck (TaionWC)",
    "url": "https://commons.wikimedia.org/wiki/Category:Rider-Waite-Smith_tarot_deck_(TaionWC)",
    "description": "Wikimedia Commons image set for scans of the Pam-A version, uploaded as a set by TaionWC."
  },
  "sourceBatchId": "commons-taionwc-185b38b7d45d4865ac4fd5f0d3420fa8dfbfa93556633841d11681694cc6acdc",
  "summary": {
    "fileCount": 78,
    "mimeType": "image/jpeg",
    "licenseShortName": "Public domain",
    "usageTerms": "Public domain",
    "artist": "Pamela Colman Smith",
    "workDate": "1910",
    "widthRange": [
      1090,
      1144
    ],
    "heightRange": [
      1919,
      1920
    ]
  },
  "files": [
    {
      "cardId": "major-00",
      "title": "File:RWS Tarot 00 Fool.jpg",
      "filePageUrl": "https://commons.wikimedia.org/wiki/File:RWS_Tarot_00_Fool.jpg",
      "originalUrl": "https://upload.wikimedia.org/wikipedia/commons/9/90/RWS_Tarot_00_Fool.jpg",
      "sha1": "a707c0123b59fd2420b05645e9d3d16b74235b42",
      "width": 1144,
      "height": 1919,
      "bytes": 1177006,
      "mimeType": "image/jpeg",
      "revisionUser": "Nosferattus",
      "revisionTimestamp": "2026-04-18T02:20:50Z",
      "licenseShortName": "Public domain",
      "usageTerms": "Public domain",
      "publicDomainMark": true,
      "pdOld80Expired": true
    },
    {
      "cardId": "major-01",
      "title": "File:RWS Tarot 01 Magician.jpg",
      "filePageUrl": "https://commons.wikimedia.org/wiki/File:RWS_Tarot_01_Magician.jpg",
      "originalUrl": "https://upload.wikimedia.org/wikipedia/commons/d/de/RWS_Tarot_01_Magician.jpg",
      "sha1": "d24df085c3c22da8cd7f88c0f2a4256c6ae50fda",
      "width": 1108,
      "height": 1920,
      "bytes": 800458,
      "mimeType": "image/jpeg",
      "revisionUser": "Nosferattus",
      "revisionTimestamp": "2026-04-18T02:21:51Z",
      "licenseShortName": "Public domain",
      "usageTerms": "Public domain",
      "publicDomainMark": true,
      "pdOld80Expired": true
    },
    {
      "cardId": "major-02",
      "title": "File:RWS Tarot 02 High Priestess.jpg",
      "filePageUrl": "https://commons.wikimedia.org/wiki/File:RWS_Tarot_02_High_Priestess.jpg",
      "originalUrl": "https://upload.wikimedia.org/wikipedia/commons/8/88/RWS_Tarot_02_High_Priestess.jpg",
      "sha1": "bb96b30d13035c34a06006ea4aca8ab9a5a98506",
      "width": 1117,
      "height": 1919,
      "bytes": 884438,
      "mimeType": "image/jpeg",
      "revisionUser": "Nosferattus",
      "revisionTimestamp": "2026-04-18T02:21:59Z",
      "licenseShortName": "Public domain",
      "usageTerms": "Public domain",
      "publicDomainMark": true,
      "pdOld80Expired": true
    },
    {
      "cardId": "major-03",
      "title": "File:RWS Tarot 03 Empress.jpg",
      "filePageUrl": "https://commons.wikimedia.org/wiki/File:RWS_Tarot_03_Empress.jpg",
      "originalUrl": "https://upload.wikimedia.org/wikipedia/commons/d/d2/RWS_Tarot_03_Empress.jpg",
      "sha1": "0c04891e42d51937390049994de8ac8867b201a1",
      "width": 1123,
      "height": 1920,
      "bytes": 949129,
      "mimeType": "image/jpeg",
      "revisionUser": "Nosferattus",
      "revisionTimestamp": "2026-04-18T02:22:14Z",
      "licenseShortName": "Public domain",
      "usageTerms": "Public domain",
      "publicDomainMark": true,
      "pdOld80Expired": true
    },
    {
      "cardId": "major-04",
      "title": "File:RWS Tarot 04 Emperor.jpg",
      "filePageUrl": "https://commons.wikimedia.org/wiki/File:RWS_Tarot_04_Emperor.jpg",
      "originalUrl": "https://upload.wikimedia.org/wikipedia/commons/c/c3/RWS_Tarot_04_Emperor.jpg",
      "sha1": "3fc0742d9a9199a226641a86b099df9540cfc3a3",
      "width": 1117,
      "height": 1919,
      "bytes": 938373,
      "mimeType": "image/jpeg",
      "revisionUser": "Nosferattus",
      "revisionTimestamp": "2026-04-18T02:22:22Z",
      "licenseShortName": "Public domain",
      "usageTerms": "Public domain",
      "publicDomainMark": true,
      "pdOld80Expired": true
    },
    {
      "cardId": "major-05",
      "title": "File:RWS Tarot 05 Hierophant.jpg",
      "filePageUrl": "https://commons.wikimedia.org/wiki/File:RWS_Tarot_05_Hierophant.jpg",
      "originalUrl": "https://upload.wikimedia.org/wikipedia/commons/8/8d/RWS_Tarot_05_Hierophant.jpg",
      "sha1": "1e7b864bcaf4c672d8fdf17e2abf7379326949c4",
      "width": 1114,
      "height": 1919,
      "bytes": 900561,
      "mimeType": "image/jpeg",
      "revisionUser": "Nosferattus",
      "revisionTimestamp": "2026-04-18T02:22:30Z",
      "licenseShortName": "Public domain",
      "usageTerms": "Public domain",
      "publicDomainMark": true,
      "pdOld80Expired": true
    },
    {
      "cardId": "major-06",
      "title": "File:RWS Tarot 06 Lovers.jpg",
      "filePageUrl": "https://commons.wikimedia.org/wiki/File:RWS_Tarot_06_Lovers.jpg",
      "originalUrl": "https://upload.wikimedia.org/wikipedia/commons/d/db/RWS_Tarot_06_Lovers.jpg",
      "sha1": "1c18b372fc4658948f2d1e9770b2aa87a2e4ac02",
      "width": 1122,
      "height": 1920,
      "bytes": 995290,
      "mimeType": "image/jpeg",
      "revisionUser": "Nosferattus",
      "revisionTimestamp": "2026-04-18T02:23:00Z",
      "licenseShortName": "Public domain",
      "usageTerms": "Public domain",
      "publicDomainMark": true,
      "pdOld80Expired": true
    },
    {
      "cardId": "major-07",
      "title": "File:RWS Tarot 07 Chariot.jpg",
      "filePageUrl": "https://commons.wikimedia.org/wiki/File:RWS_Tarot_07_Chariot.jpg",
      "originalUrl": "https://upload.wikimedia.org/wikipedia/commons/9/9b/RWS_Tarot_07_Chariot.jpg",
      "sha1": "8a93a2130017d32a7e8f9612d0874b5b1b41f83d",
      "width": 1111,
      "height": 1919,
      "bytes": 859575,
      "mimeType": "image/jpeg",
      "revisionUser": "Nosferattus",
      "revisionTimestamp": "2026-04-18T02:22:48Z",
      "licenseShortName": "Public domain",
      "usageTerms": "Public domain",
      "publicDomainMark": true,
      "pdOld80Expired": true
    },
    {
      "cardId": "major-08",
      "title": "File:RWS Tarot 08 Strength.jpg",
      "filePageUrl": "https://commons.wikimedia.org/wiki/File:RWS_Tarot_08_Strength.jpg",
      "originalUrl": "https://upload.wikimedia.org/wikipedia/commons/f/f5/RWS_Tarot_08_Strength.jpg",
      "sha1": "16baefeee43cee6b285838d27af690a0cf7e9db6",
      "width": 1114,
      "height": 1919,
      "bytes": 806480,
      "mimeType": "image/jpeg",
      "revisionUser": "Nosferattus",
      "revisionTimestamp": "2026-04-18T02:22:56Z",
      "licenseShortName": "Public domain",
      "usageTerms": "Public domain",
      "publicDomainMark": true,
      "pdOld80Expired": true
    },
    {
      "cardId": "major-09",
      "title": "File:RWS Tarot 09 Hermit.jpg",
      "filePageUrl": "https://commons.wikimedia.org/wiki/File:RWS_Tarot_09_Hermit.jpg",
      "originalUrl": "https://upload.wikimedia.org/wikipedia/commons/4/4d/RWS_Tarot_09_Hermit.jpg",
      "sha1": "106bf91c47522063c78d60ab412c53064541f617",
      "width": 1123,
      "height": 1920,
      "bytes": 735989,
      "mimeType": "image/jpeg",
      "revisionUser": "Nosferattus",
      "revisionTimestamp": "2026-04-18T02:23:05Z",
      "licenseShortName": "Public domain",
      "usageTerms": "Public domain",
      "publicDomainMark": true,
      "pdOld80Expired": true
    },
    {
      "cardId": "major-10",
      "title": "File:RWS Tarot 10 Wheel of Fortune.jpg",
      "filePageUrl": "https://commons.wikimedia.org/wiki/File:RWS_Tarot_10_Wheel_of_Fortune.jpg",
      "originalUrl": "https://upload.wikimedia.org/wikipedia/commons/3/3c/RWS_Tarot_10_Wheel_of_Fortune.jpg",
      "sha1": "0758555fa3b5960fb631cba01879f3be0260a278",
      "width": 1104,
      "height": 1920,
      "bytes": 1155837,
      "mimeType": "image/jpeg",
      "revisionUser": "Nosferattus",
      "revisionTimestamp": "2026-04-18T02:23:17Z",
      "licenseShortName": "Public domain",
      "usageTerms": "Public domain",
      "publicDomainMark": true,
      "pdOld80Expired": true
    },
    {
      "cardId": "major-11",
      "title": "File:RWS Tarot 11 Justice.jpg",
      "filePageUrl": "https://commons.wikimedia.org/wiki/File:RWS_Tarot_11_Justice.jpg",
      "originalUrl": "https://upload.wikimedia.org/wikipedia/commons/e/e0/RWS_Tarot_11_Justice.jpg",
      "sha1": "16404e646dac8b8f5de4841b9259065059a04f71",
      "width": 1114,
      "height": 1919,
      "bytes": 893399,
      "mimeType": "image/jpeg",
      "revisionUser": "Nosferattus",
      "revisionTimestamp": "2026-04-18T02:23:26Z",
      "licenseShortName": "Public domain",
      "usageTerms": "Public domain",
      "publicDomainMark": true,
      "pdOld80Expired": true
    },
    {
      "cardId": "major-12",
      "title": "File:RWS Tarot 12 Hanged Man.jpg",
      "filePageUrl": "https://commons.wikimedia.org/wiki/File:RWS_Tarot_12_Hanged_Man.jpg",
      "originalUrl": "https://upload.wikimedia.org/wikipedia/commons/2/2b/RWS_Tarot_12_Hanged_Man.jpg",
      "sha1": "41d2398a09087cc2936fcc70fcde7d92552331fd",
      "width": 1092,
      "height": 1920,
      "bytes": 1138974,
      "mimeType": "image/jpeg",
      "revisionUser": "Nosferattus",
      "revisionTimestamp": "2026-04-18T02:23:35Z",
      "licenseShortName": "Public domain",
      "usageTerms": "Public domain",
      "publicDomainMark": true,
      "pdOld80Expired": true
    },
    {
      "cardId": "major-13",
      "title": "File:RWS Tarot 13 Death.jpg",
      "filePageUrl": "https://commons.wikimedia.org/wiki/File:RWS_Tarot_13_Death.jpg",
      "originalUrl": "https://upload.wikimedia.org/wikipedia/commons/d/d7/RWS_Tarot_13_Death.jpg",
      "sha1": "a49bfe7b626af084f33a67dbb22c001718f80a80",
      "width": 1111,
      "height": 1919,
      "bytes": 922316,
      "mimeType": "image/jpeg",